"No.","Time","Source","Destination","Protocol","Length","Info"
"1","0.000000","10.200.1.18","10.50.1.54","CIP PCCC","112","PCCC Class - Execute PCCC - Diagnostic status"
"2","0.000356","10.200.1.18","10.50.1.54","TCP","112","[TCP Retransmission] 2430  >  44818 [PSH, ACK] Seq=1 Ack=1 Win=63600 Len=58"
"3","0.009772","10.50.1.54","10.200.1.18","CIP PCCC","134","Success: PCCC Class - Execute PCCC"
"4","0.022070","10.50.1.54","10.200.1.18","TCP","134","[TCP Retransmission] 44818  >  2430 [PSH, ACK] Seq=1 Ack=59 Win=2000 Len=80"
"5","0.030629","10.200.1.18","10.50.1.54","CIP PCCC","112","PCCC Class - Execute PCCC - Diagnostic status"
"6","0.030867","10.200.1.18","10.50.1.54","TCP","112","[TCP Retransmission] 2430  >  44818 [PSH, ACK] Seq=59 Ack=81 Win=63520 Len=58"
"7","0.039979","10.50.1.54","10.200.1.18","CIP PCCC","134","Success: PCCC Class - Execute PCCC"
"8","0.040179","10.50.1.54","10.200.1.18","TCP","134","[TCP Retransmission] 44818  >  2430 [PSH, ACK] Seq=81 Ack=117 Win=2000 Len=80"
"9","0.058596","10.200.1.18","10.50.1.54","CIP PCCC","112","PCCC Class - Execute PCCC - Diagnostic status"
"10","0.058986","10.200.1.18","10.50.1.54","TCP","112","[TCP Retransmission] 2430  >  44818 [PSH, ACK] Seq=117 Ack=161 Win=63440 Len=58"
"11","0.059773","10.200.1.18","10.200.1.252","BROWSER","227","Get Backup List Response"
"12","0.069623","10.50.1.54","10.200.1.18","CIP PCCC","134","Success: PCCC Class - Execute PCCC"
"13","0.069891","10.50.1.54","10.200.1.18","TCP","134","[TCP Retransmission] 44818  >  2430 [PSH, ACK] Seq=161 Ack=175 Win=2000 Len=80"
"14","0.078379","10.200.1.252","10.200.1.18","NBNS","92","Name query NBSTAT OICU812-XP<20>"
"15","0.079249","10.200.1.18","10.200.1.252","NBNS","271","Name query response NBSTAT"
"16","0.088848","10.200.1.18","10.50.1.54","CIP PCCC","112","PCCC Class - Execute PCCC - Diagnostic status"
"17","0.089923","10.200.1.18","10.50.1.54","TCP","112","[TCP Retransmission] 2430  >  44818 [PSH, ACK] Seq=175 Ack=241 Win=63360 Len=58"
"18","0.099917","10.50.1.54","10.200.1.18","CIP PCCC","134","Success: PCCC Class - Execute PCCC"
"19","0.103093","10.50.1.54","10.200.1.18","TCP","134","[TCP Retransmission] 44818  >  2430 [PSH, ACK] Seq=241 Ack=233 Win=2000 Len=80"
"20","0.122237","10.200.1.18","10.50.1.54","CIP PCCC","112","PCCC Class - Execute PCCC - Diagnostic status"
"21","0.123668","10.200.1.18","10.50.1.54","TCP","112","[TCP Retransmission] 2430  >  44818 [PSH, ACK] Seq=233 Ack=321 Win=63280 Len=58"
"22","0.129937","10.50.1.54","10.200.1.18","CIP PCCC","134","Success: PCCC Class - Execute PCCC"
"23","0.130294","10.50.1.54","10.200.1.18","TCP","134","[TCP Retransmission] 44818  >  2430 [PSH, ACK] Seq=321 Ack=291 Win=2000 Len=80"
"24","0.148503","10.200.1.18","10.50.1.54","CIP PCCC","112","PCCC Class - Execute PCCC - Diagnostic status"
"25","0.148845","10.200.1.18","10.50.1.54","TCP","112","[TCP Retransmission] 2430  >  44818 [PSH, ACK] Seq=291 Ack=401 Win=63200 Len=58"
"26","0.159960","10.50.1.54","10.200.1.18","CIP PCCC","134","Success: PCCC Class - Execute PCCC"
"27","0.160218","10.50.1.54","10.200.1.18","TCP","134","[TCP Retransmission] 44818  >  2430 [PSH, ACK] Seq=401 Ack=349 Win=2000 Len=80"
"28","0.178817","10.200.1.18","10.50.1.54","CIP PCCC","112","PCCC Class - Execute PCCC - Diagnostic status"
"29","0.179202","10.200.1.18","10.50.1.54","TCP","112","[TCP Retransmission] 2430  >  44818 [PSH, ACK] Seq=349 Ack=481 Win=63120 Len=58"
"30","0.189725","10.50.1.54","10.200.1.18","CIP PCCC","134","Success: PCCC Class - Execute PCCC"
"31","0.189941","10.50.1.54","10.200.1.18","TCP","134","[TCP Retransmission] 44818  >  2430 [PSH, ACK] Seq=481 Ack=407 Win=2000 Len=80"
"32","0.219690","10.200.1.18","10.50.1.54","CIP PCCC","112","PCCC Class - Execute PCCC - Diagnostic status"
"33","0.220064","10.200.1.18","10.50.1.54","TCP","112","[TCP Retransmission] 2430  >  44818 [PSH, ACK] Seq=407 Ack=561 Win=63040 Len=58"
"34","0.229954","10.50.1.54","10.200.1.18","CIP PCCC","134","Success: PCCC Class - Execute PCCC"
"35","0.230233","10.50.1.54","10.200.1.18","TCP","134","[TCP Retransmission] 44818  >  2430 [PSH, ACK] Seq=561 Ack=465 Win=2000 Len=80"
"36","0.248979","10.200.1.18","10.50.1.54","CIP PCCC","112","PCCC Class - Execute PCCC - Diagnostic status"
"37","0.249290","10.200.1.18","10.50.1.54","TCP","112","[TCP Retransmission] 2430  >  44818 [PSH, ACK] Seq=465 Ack=641 Win=62960 Len=58"
"38","0.259655","10.50.1.54","10.200.1.18","CIP PCCC","134","Success: PCCC Class - Execute PCCC"
"39","0.259899","10.50.1.54","10.200.1.18","TCP","134","[TCP Retransmission] 44818  >  2430 [PSH, ACK] Seq=641 Ack=523 Win=2000 Len=80"
"40","0.278613","10.200.1.18","10.50.1.54","CIP PCCC","112","PCCC Class - Execute PCCC - Diagnostic status"
"41","0.279098","10.200.1.18","10.50.1.54","TCP","112","[TCP Retransmission] 2430  >  44818 [PSH, ACK] Seq=523 Ack=721 Win=62880 Len=58"
"42","0.289765","10.50.1.54","10.200.1.18","CIP PCCC","134","Success: PCCC Class - Execute PCCC"
"43","0.290125","10.50.1.54","10.200.1.18","TCP","134","[TCP Retransmission] 44818  >  2430 [PSH, ACK] Seq=721 Ack=581 Win=2000 Len=80"
"44","0.308566","10.200.1.18","10.50.1.54","CIP PCCC","112","PCCC Class - Execute PCCC - Diagnostic status"
"45","0.308931","10.200.1.18","10.50.1.54","TCP","112","[TCP Retransmission] 2430  >  44818 [PSH, ACK] Seq=581 Ack=801 Win=62800 Len=58"
"46","0.319681","10.50.1.54","10.200.1.18","CIP PCCC","134","Success: PCCC Class - Execute PCCC"
"47","0.319879","10.50.1.54","10.200.1.18","TCP","134","[TCP Retransmission] 44818  >  2430 [PSH, ACK] Seq=801 Ack=639 Win=2000 Len=80"
"48","0.338823","10.200.1.18","10.50.1.54","CIP PCCC","112","PCCC Class - Execute PCCC - Diagnostic status"
"49","0.339154","10.200.1.18","10.50.1.54","TCP","112","[TCP Retransmission] 2430  >  44818 [PSH, ACK] Seq=639 Ack=881 Win=64240 Len=58"
"50","0.349998","10.50.1.54","10.200.1.18","CIP PCCC","134","Success: PCCC Class - Execute PCCC"
"51","0.351596","10.50.1.54","10.200.1.18","TCP","134","[TCP Retransmission] 44818  >  2430 [PSH, ACK] Seq=881 Ack=697 Win=2000 Len=80"
"52","0.371073","10.200.1.18","10.50.1.54","CIP PCCC","112","PCCC Class - Execute PCCC - Diagnostic status"
"53","0.371414","10.200.1.18","10.50.1.54","TCP","112","[TCP Retransmission] 2430  >  44818 [PSH, ACK] Seq=697 Ack=961 Win=64160 Len=58"
"54","0.379730","10.50.1.54","10.200.1.18","CIP PCCC","134","Success: PCCC Class - Execute PCCC"
"55","0.379972","10.50.1.54","10.200.1.18","TCP","134","[TCP Retransmission] 44818  >  2430 [PSH, ACK] Seq=961 Ack=755 Win=2000 Len=80"
"56","0.398422","10.200.1.18","10.50.1.54","CIP PCCC","112","PCCC Class - Execute PCCC - Diagnostic status"
"57","0.398581","10.200.1.18","10.50.1.54","TCP","112","[TCP Retransmission] 2430  >  44818 [PSH, ACK] Seq=755 Ack=1041 Win=64080 Len=58"
"58","0.409543","10.50.1.54","10.200.1.18","CIP PCCC","134","Success: PCCC Class - Execute PCCC"
"59","0.409842","10.50.1.54","10.200.1.18","TCP","134","[TCP Retransmission] 44818  >  2430 [PSH, ACK] Seq=1041 Ack=813 Win=2000 Len=80"
"60","0.437476","10.200.1.18","10.50.1.54","CIP PCCC","112","PCCC Class - Execute PCCC - Diagnostic status"
"61","0.437835","10.200.1.18","10.50.1.54","TCP","112","[TCP Retransmission] 2430  >  44818 [PSH, ACK] Seq=813 Ack=1121 Win=64000 Len=58"
"62","0.449501","10.50.1.54","10.200.1.18","CIP PCCC","134","Success: PCCC Class - Execute PCCC"
"63","0.449746","10.50.1.54","10.200.1.18","TCP","134","[TCP Retransmission] 44818  >  2430 [PSH, ACK] Seq=1121 Ack=871 Win=2000 Len=80"
"64","0.468774","10.200.1.18","10.50.1.54","CIP PCCC","112","PCCC Class - Execute PCCC - Diagnostic status"
"65","0.469135","10.200.1.18","10.50.1.54","TCP","112","[TCP Retransmission] 2430  >  44818 [PSH, ACK] Seq=871 Ack=1201 Win=63920 Len=58"
"66","0.479780","10.50.1.54","10.200.1.18","CIP PCCC","134","Success: PCCC Class - Execute PCCC"
"67","0.480075","10.50.1.54","10.200.1.18","TCP","134","[TCP Retransmission] 44818  >  2430 [PSH, ACK] Seq=1201 Ack=929 Win=2000 Len=80"
"68","0.500070","10.200.1.18","10.50.1.54","CIP PCCC","112","PCCC Class - Execute PCCC - Diagnostic status"
"69","0.500296","10.200.1.18","10.50.1.54","TCP","112","[TCP Retransmission] 2430  >  44818 [PSH, ACK] Seq=929 Ack=1281 Win=63840 Len=58"
"70","0.509599","10.50.1.54","10.200.1.18","CIP PCCC","134","Success: PCCC Class - Execute PCCC"
"71","0.509875","10.50.1.54","10.200.1.18","TCP","134","[TCP Retransmission] 44818  >  2430 [PSH, ACK] Seq=1281 Ack=987 Win=2000 Len=80"
"72","0.528363","10.200.1.18","10.50.1.54","CIP PCCC","112","PCCC Class - Execute PCCC - Diagnostic status"
"73","0.528712","10.200.1.18","10.50.1.54","TCP","112","[TCP Retransmission] 2430  >  44818 [PSH, ACK] Seq=987 Ack=1361 Win=63760 Len=58"
"74","0.539788","10.50.1.54","10.200.1.18","CIP PCCC","134","Success: PCCC Class - Execute PCCC"
"75","0.540018","10.50.1.54","10.200.1.18","TCP","134","[TCP Retransmission] 44818  >  2430 [PSH, ACK] Seq=1361 Ack=1045 Win=2000 Len=80"
"76","0.558583","10.200.1.18","10.50.1.54","CIP PCCC","112","PCCC Class - Execute PCCC - Diagnostic status"
"77","0.558894","10.200.1.18","10.50.1.54","TCP","112","[TCP Retransmission] 2430  >  44818 [PSH, ACK] Seq=1045 Ack=1441 Win=63680 Len=58"
"78","0.569641","10.50.1.54","10.200.1.18","CIP PCCC","134","Success: PCCC Class - Execute PCCC"
"79","0.573036","10.50.1.54","10.200.1.18","TCP","134","[TCP Retransmission] 44818  >  2430 [PSH, ACK] Seq=1441 Ack=1103 Win=2000 Len=80"
"80","0.591814","10.200.1.18","10.50.1.54","CIP PCCC","112","PCCC Class - Execute PCCC - Diagnostic status"
"81","0.591885","10.200.1.18","10.50.1.54","TCP","112","[TCP Retransmission] 2430  >  44818 [PSH, ACK] Seq=1103 Ack=1521 Win=63600 Len=58"
"82","0.599897","10.50.1.54","10.200.1.18","CIP PCCC","134","Success: PCCC Class - Execute PCCC"
"83","0.600101","10.50.1.54","10.200.1.18","TCP","134","[TCP Retransmission] 44818  >  2430 [PSH, ACK] Seq=1521 Ack=1161 Win=2000 Len=80"
"84","0.619117","10.200.1.18","10.50.1.54","CIP PCCC","112","PCCC Class - Execute PCCC - Diagnostic status"
"85","0.619431","10.200.1.18","10.50.1.54","TCP","112","[TCP Retransmission] 2430  >  44818 [PSH, ACK] Seq=1161 Ack=1601 Win=63520 Len=58"
"86","0.629951","10.50.1.54","10.200.1.18","CIP PCCC","134","Success: PCCC Class - Execute PCCC"
"87","0.630323","10.50.1.54","10.200.1.18","TCP","134","[TCP Retransmission] 44818  >  2430 [PSH, ACK] Seq=1601 Ack=1219 Win=2000 Len=80"
"88","0.648628","10.200.1.18","10.50.1.54","CIP PCCC","112","PCCC Class - Execute PCCC - Diagnostic status"
"89","0.648633","10.200.1.18","10.50.1.54","TCP","112","[TCP Retransmission] 2430  >  44818 [PSH, ACK] Seq=1219 Ack=1681 Win=63440 Len=58"
"90","0.659931","10.50.1.54","10.200.1.18","CIP PCCC","134","Success: PCCC Class - Execute PCCC"
"91","0.660251","10.50.1.54","10.200.1.18","TCP","134","[TCP Retransmission] 44818  >  2430 [PSH, ACK] Seq=1681 Ack=1277 Win=2000 Len=80"
"92","0.678695","10.200.1.18","10.50.1.54","CIP PCCC","112","PCCC Class - Execute PCCC - Diagnostic status"
"93","0.679019","10.200.1.18","10.50.1.54","TCP","112","[TCP Retransmission] 2430  >  44818 [PSH, ACK] Seq=1277 Ack=1761 Win=63360 Len=58"
"94","0.689671","10.50.1.54","10.200.1.18","CIP PCCC","134","Success: PCCC Class - Execute PCCC"
"95","0.689938","10.50.1.54","10.200.1.18","TCP","134","[TCP Retransmission] 44818  >  2430 [PSH, ACK] Seq=1761 Ack=1335 Win=2000 Len=80"
"96","0.719837","10.200.1.18","10.50.1.54","CIP PCCC","112","PCCC Class - Execute PCCC - Diagnostic status"
"97","0.720060","10.200.1.18","10.50.1.54","TCP","112","[TCP Retransmission] 2430  >  44818 [PSH, ACK] Seq=1335 Ack=1841 Win=63280 Len=58"
"98","0.730214","10.50.1.54","10.200.1.18","CIP PCCC","134","Success: PCCC Class - Execute PCCC"
"99","0.730318","10.50.1.54","10.200.1.18","TCP","134","[TCP Retransmission] 44818  >  2430 [PSH, ACK] Seq=1841 Ack=1393 Win=2000 Len=80"
"100","0.750090","10.200.1.18","10.50.1.54","CIP PCCC","112","PCCC Class - Execute PCCC - Diagnostic status"
"101","0.750297","10.200.1.18","10.50.1.54","TCP","112","[TCP Retransmission] 2430  >  44818 [PSH, ACK] Seq=1393 Ack=1921 Win=63200 Len=58"
"102","0.759606","10.50.1.54","10.200.1.18","CIP PCCC","134","Success: PCCC Class - Execute PCCC"
"103","0.759988","10.50.1.54","10.200.1.18","TCP","134","[TCP Retransmission] 44818  >  2430 [PSH, ACK] Seq=1921 Ack=1451 Win=2000 Len=80"
"104","0.778300","10.200.1.18","10.50.1.54","CIP PCCC","112","PCCC Class - Execute PCCC - Diagnostic status"
"105","0.778622","10.200.1.18","10.50.1.54","TCP","112","[TCP Retransmission] 2430  >  44818 [PSH, ACK] Seq=1451 Ack=2001 Win=63120 Len=58"
"106","0.789815","10.50.1.54","10.200.1.18","CIP PCCC","134","Success: PCCC Class - Execute PCCC"
"107","0.794386","10.50.1.54","10.200.1.18","TCP","134","[TCP Retransmission] 44818  >  2430 [PSH, ACK] Seq=2001 Ack=1509 Win=2000 Len=80"
"108","0.812439","10.200.1.18","10.50.1.54","CIP PCCC","112","PCCC Class - Execute PCCC - Diagnostic status"
"109","0.812790","10.200.1.18","10.50.1.54","TCP","112","[TCP Retransmission] 2430  >  44818 [PSH, ACK] Seq=1509 Ack=2081 Win=63040 Len=58"
"110","0.819676","10.50.1.54","10.200.1.18","CIP PCCC","134","Success: PCCC Class - Execute PCCC"
"111","0.820059","10.50.1.54","10.200.1.18","TCP","134","[TCP Retransmission] 44818  >  2430 [PSH, ACK] Seq=2081 Ack=1567 Win=2000 Len=80"
"112","0.838912","10.200.1.18","10.50.1.54","CIP PCCC","112","PCCC Class - Execute PCCC - Diagnostic status"
"113","0.839248","10.200.1.18","10.50.1.54","TCP","112","[TCP Retransmission] 2430  >  44818 [PSH, ACK] Seq=1567 Ack=2161 Win=62960 Len=58"
"114","0.849528","10.50.1.54","10.200.1.18","CIP PCCC","134","Success: PCCC Class - Execute PCCC"
"115","0.849887","10.50.1.54","10.200.1.18","TCP","134","[TCP Retransmission] 44818  >  2430 [PSH, ACK] Seq=2161 Ack=1625 Win=2000 Len=80"
"116","0.869219","10.200.1.18","10.50.1.54","CIP PCCC","112","PCCC Class - Execute PCCC - Diagnostic status"
"117","0.869517","10.200.1.18","10.50.1.54","TCP","112","[TCP Retransmission] 2430  >  44818 [PSH, ACK] Seq=1625 Ack=2241 Win=62880 Len=58"
"118","0.879736","10.50.1.54","10.200.1.18","CIP PCCC","134","Success: PCCC Class - Execute PCCC"
"119","0.880116","10.50.1.54","10.200.1.18","TCP","134","[TCP Retransmission] 44818  >  2430 [PSH, ACK] Seq=2241 Ack=1683 Win=2000 Len=80"
"120","0.898415","10.200.1.18","10.50.1.54","CIP PCCC","112","PCCC Class - Execute PCCC - Diagnostic status"
"121","0.898743","10.200.1.18","10.50.1.54","TCP","112","[TCP Retransmission] 2430  >  44818 [PSH, ACK] Seq=1683 Ack=2321 Win=62800 Len=58"
"122","0.909588","10.50.1.54","10.200.1.18","CIP PCCC","134","Success: PCCC Class - Execute PCCC"
"123","0.909842","10.50.1.54","10.200.1.18","TCP","134","[TCP Retransmission] 44818  >  2430 [PSH, ACK] Seq=2321 Ack=1741 Win=2000 Len=80"
"124","0.937459","10.200.1.18","10.50.1.54","CIP PCCC","112","PCCC Class - Execute PCCC - Diagnostic status"
"125","0.937734","10.200.1.18","10.50.1.54","TCP","112","[TCP Retransmission] 2430  >  44818 [PSH, ACK] Seq=1741 Ack=2401 Win=64240 Len=58"
"126","0.949727","10.50.1.54","10.200.1.18","CIP PCCC","134","Success: PCCC Class - Execute PCCC"
"127","0.949964","10.50.1.54","10.200.1.18","TCP","134","[TCP Retransmission] 44818  >  2430 [PSH, ACK] Seq=2401 Ack=1799 Win=2000 Len=80"
"128","0.968802","10.200.1.18","10.50.1.54","CIP PCCC","112","PCCC Class - Execute PCCC - Diagnostic status"
"129","0.969126","10.200.1.18","10.50.1.54","TCP","112","[TCP Retransmission] 2430  >  44818 [PSH, ACK] Seq=1799 Ack=2481 Win=64160 Len=58"
"130","0.979795","10.50.1.54","10.200.1.18","CIP PCCC","134","Success: PCCC Class - Execute PCCC"
"131","0.998426","10.50.1.54","10.200.1.18","TCP","134","[TCP Retransmission] 44818  >  2430 [PSH, ACK] Seq=2481 Ack=1857 Win=2000 Len=80"
"132","1.007602","10.200.1.18","10.50.1.54","CIP PCCC","112","PCCC Class - Execute PCCC - Diagnostic status"
"133","1.007957","10.200.1.18","10.50.1.54","TCP","112","[TCP Retransmission] 2430  >  44818 [PSH, ACK] Seq=1857 Ack=2561 Win=64080 Len=58"
"134","1.019616","10.50.1.54","10.200.1.18","CIP PCCC","134","Success: PCCC Class - Execute PCCC"
"135","1.019920","10.50.1.54","10.200.1.18","TCP","134","[TCP Retransmission] 44818  >  2430 [PSH, ACK] Seq=2561 Ack=1915 Win=2000 Len=80"
"136","1.028249","10.200.1.162","10.200.1.18","TCP","60","36232  >  139 [SYN] Seq=0 Win=1024 Len=0 MSS=1460"
"137","1.028282","10.200.1.162","10.200.1.18","TCP","60","36180  >  64680 [SYN] Seq=0 Win=1024 Len=0 MSS=1460"
"138","1.028814","10.200.1.18","10.200.1.162","TCP","60","139  >  36232 [SYN, ACK] Seq=0 Ack=1 Win=64240 Len=0 MSS=1460"
"139","1.037918","10.200.1.18","10.50.1.54","CIP PCCC","112","PCCC Class - Execute PCCC - Diagnostic status"
"140","1.038019","10.200.1.18","10.50.1.54","TCP","112","[TCP Retransmission] 2430  >  44818 [PSH, ACK] Seq=1915 Ack=2641 Win=64000 Len=58"
"141","1.049911","10.50.1.54","10.200.1.18","CIP PCCC","134","Success: PCCC Class - Execute PCCC"
"142","1.050046","10.50.1.54","10.200.1.18","TCP","134","[TCP Retransmission] 44818  >  2430 [PSH, ACK] Seq=2641 Ack=1973 Win=2000 Len=80"
"143","1.077132","10.200.1.18","10.50.1.54","CIP PCCC","112","PCCC Class - Execute PCCC - Diagnostic status"
"144","1.077468","10.200.1.18","10.50.1.54","TCP","112","[TCP Retransmission] 2430  >  44818 [PSH, ACK] Seq=1973 Ack=2721 Win=63920 Len=58"
"145","1.089578","10.50.1.54","10.200.1.18","CIP PCCC","134","Success: PCCC Class - Execute PCCC"
"146","1.090424","10.50.1.54","10.200.1.18","TCP","134","[TCP Retransmission] 44818  >  2430 [PSH, ACK] Seq=2721 Ack=2031 Win=2000 Len=80"
"147","1.108325","10.200.1.18","10.50.1.54","CIP PCCC","112","PCCC Class - Execute PCCC - Diagnostic status"
"148","1.108679","10.200.1.18","10.50.1.54","TCP","112","[TCP Retransmission] 2430  >  44818 [PSH, ACK] Seq=2031 Ack=2801 Win=63840 Len=58"
"149","1.119745","10.50.1.54","10.200.1.18","CIP PCCC","134","Success: PCCC Class - Execute PCCC"
"150","1.120045","10.50.1.54","10.200.1.18","TCP","134","[TCP Retransmission] 44818  >  2430 [PSH, ACK] Seq=2801 Ack=2089 Win=2000 Len=80"
"151","1.138843","10.200.1.18","10.50.1.54","CIP PCCC","112","PCCC Class - Execute PCCC - Diagnostic status"
"152","1.139012","10.200.1.18","10.50.1.54","TCP","112","[TCP Retransmission] 2430  >  44818 [PSH, ACK] Seq=2089 Ack=2881 Win=63760 Len=58"
"153","1.149745","10.50.1.54","10.200.1.18","CIP PCCC","134","Success: PCCC Class - Execute PCCC"
"154","1.150335","10.50.1.54","10.200.1.18","TCP","134","[TCP Retransmission] 44818  >  2430 [PSH, ACK] Seq=2881 Ack=2147 Win=2000 Len=80"
"155","1.170057","10.200.1.18","10.50.1.54","CIP PCCC","112","PCCC Class - Execute PCCC - Diagnostic status"
"156","1.170259","10.200.1.18","10.50.1.54","TCP","112","[TCP Retransmission] 2430  >  44818 [PSH, ACK] Seq=2147 Ack=2961 Win=63680 Len=58"
"157","1.179675","10.50.1.54","10.200.1.18","CIP PCCC","134","Success: PCCC Class - Execute PCCC"
"158","1.181400","10.50.1.54","10.200.1.18","TCP","134","[TCP Retransmission] 44818  >  2430 [PSH, ACK] Seq=2961 Ack=2205 Win=2000 Len=80"
"159","1.199203","10.200.1.18","10.50.1.54","CIP PCCC","112","PCCC Class - Execute PCCC - Diagnostic status"
"160","1.199578","10.200.1.18","10.50.1.54","TCP","112","[TCP Retransmission] 2430  >  44818 [PSH, ACK] Seq=2205 Ack=3041 Win=63600 Len=58"
"161","1.209553","10.50.1.54","10.200.1.18","CIP PCCC","134","Success: PCCC Class - Execute PCCC"
"162","1.210427","10.50.1.54","10.200.1.18","TCP","134","[TCP Retransmission] 44818  >  2430 [PSH, ACK] Seq=3041 Ack=2263 Win=2000 Len=80"
"163","1.228478","10.200.1.18","10.50.1.54","CIP PCCC","112","PCCC Class - Execute PCCC - Diagnostic status"
"164","1.228840","10.200.1.18","10.50.1.54","TCP","112","[TCP Retransmission] 2430  >  44818 [PSH, ACK] Seq=2263 Ack=3121 Win=63520 Len=58"
"165","1.240029","10.50.1.54","10.200.1.18","CIP PCCC","134","Success: PCCC Class - Execute PCCC"
"166","1.240284","10.50.1.54","10.200.1.18","TCP","134","[TCP Retransmission] 44818  >  2430 [PSH, ACK] Seq=3121 Ack=2321 Win=2000 Len=80"
"167","1.258725","10.200.1.18","10.50.1.54","CIP PCCC","112","PCCC Class - Execute PCCC - Diagnostic status"
"168","1.259040","10.200.1.18","10.50.1.54","TCP","112","[TCP Retransmission] 2430  >  44818 [PSH, ACK] Seq=2321 Ack=3201 Win=63440 Len=58"
"169","1.269843","10.50.1.54","10.200.1.18","CIP PCCC","134","Success: PCCC Class - Execute PCCC"
"170","1.270052","10.50.1.54","10.200.1.18","TCP","134","[TCP Retransmission] 44818  >  2430 [PSH, ACK] Seq=3201 Ack=2379 Win=2000 Len=80"
"171","1.289107","10.200.1.18","10.50.1.54","CIP PCCC","112","PCCC Class - Execute PCCC - Diagnostic status"
"172","1.290375","10.200.1.18","10.50.1.54","TCP","112","[TCP Retransmission] 2430  >  44818 [PSH, ACK] Seq=2379 Ack=3281 Win=63360 Len=58"
"173","1.299755","10.50.1.54","10.200.1.18","CIP PCCC","134","Success: PCCC Class - Execute PCCC"
"174","1.301181","10.50.1.54","10.200.1.18","TCP","134","[TCP Retransmission] 44818  >  2430 [PSH, ACK] Seq=3281 Ack=2437 Win=2000 Len=80"
"175","1.319354","10.200.1.18","10.50.1.54","CIP PCCC","112","PCCC Class - Execute PCCC - Diagnostic status"
"176","1.320212","10.200.1.18","10.50.1.54","TCP","112","[TCP Retransmission] 2430  >  44818 [PSH, ACK] Seq=2437 Ack=3361 Win=63280 Len=58"
"177","1.330586","10.50.1.54","10.200.1.18","CIP PCCC","134","Success: PCCC Class - Execute PCCC"
"178","1.330719","10.50.1.54","10.200.1.18","TCP","134","[TCP Retransmission] 44818  >  2430 [PSH, ACK] Seq=3361 Ack=2495 Win=2000 Len=80"
"179","1.358350","10.200.1.18","10.50.1.54","CIP PCCC","112","PCCC Class - Execute PCCC - Diagnostic status"
"180","1.358558","10.200.1.18","10.50.1.54","TCP","112","[TCP Retransmission] 2430  >  44818 [PSH, ACK] Seq=2495 Ack=3441 Win=63200 Len=58"
"181","1.369679","10.50.1.54","10.200.1.18","CIP PCCC","134","Success: PCCC Class - Execute PCCC"
"182","1.370055","10.50.1.54","10.200.1.18","TCP","134","[TCP Retransmission] 44818  >  2430 [PSH, ACK] Seq=3441 Ack=2553 Win=2000 Len=80"
"183","1.388667","10.200.1.18","10.50.1.54","CIP PCCC","112","PCCC Class - Execute PCCC - Diagnostic status"
"184","1.389349","10.200.1.18","10.50.1.54","TCP","112","[TCP Retransmission] 2430  >  44818 [PSH, ACK] Seq=2553 Ack=3521 Win=63120 Len=58"
"185","1.399954","10.50.1.54","10.200.1.18","CIP PCCC","134","Success: PCCC Class - Execute PCCC"
"186","1.400340","10.50.1.54","10.200.1.18","TCP","134","[TCP Retransmission] 44818  >  2430 [PSH, ACK] Seq=3521 Ack=2611 Win=2000 Len=80"
"187","1.419897","10.200.1.18","10.50.1.54","CIP PCCC","112","PCCC Class - Execute PCCC - Diagnostic status"
"188","1.420153","10.200.1.18","10.50.1.54","TCP","112","[TCP Retransmission] 2430  >  44818 [PSH, ACK] Seq=2611 Ack=3601 Win=63040 Len=58"
"189","1.430354","10.50.1.54","10.200.1.18","CIP PCCC","134","Success: PCCC Class - Execute PCCC"
"190","1.430660","10.50.1.54","10.200.1.18","TCP","134","[TCP Retransmission] 44818  >  2430 [PSH, ACK] Seq=3601 Ack=2669 Win=2000 Len=80"
"191","1.449338","10.200.1.18","10.50.1.54","CIP PCCC","112","PCCC Class - Execute PCCC - Diagnostic status"
"192","1.449700","10.200.1.18","10.50.1.54","TCP","112","[TCP Retransmission] 2430  >  44818 [PSH, ACK] Seq=2669 Ack=3681 Win=62960 Len=58"
"193","1.459870","10.50.1.54","10.200.1.18","CIP PCCC","134","Success: PCCC Class - Execute PCCC"
"194","1.460219","10.50.1.54","10.200.1.18","TCP","134","[TCP Retransmission] 44818  >  2430 [PSH, ACK] Seq=3681 Ack=2727 Win=2000 Len=80"
"195","1.478485","10.200.1.18","10.50.1.54","CIP PCCC","112","PCCC Class - Execute PCCC - Diagnostic status"
"196","1.478825","10.200.1.18","10.50.1.54","TCP","112","[TCP Retransmission] 2430  >  44818 [PSH, ACK] Seq=2727 Ack=3761 Win=62880 Len=58"
"197","1.489607","10.50.1.54","10.200.1.18","CIP PCCC","134","Success: PCCC Class - Execute PCCC"
"198","1.489882","10.50.1.54","10.200.1.18","TCP","134","[TCP Retransmission] 44818  >  2430 [PSH, ACK] Seq=3761 Ack=2785 Win=2000 Len=80"
"199","1.507803","10.200.1.18","10.50.1.54","CIP PCCC","112","PCCC Class - Execute PCCC - Diagnostic status"
"200","1.508087","10.200.1.18","10.50.1.54","TCP","112","[TCP Retransmission] 2430  >  44818 [PSH, ACK] Seq=2785 Ack=3841 Win=62800 Len=58"
"201","1.519948","10.50.1.54","10.200.1.18","CIP PCCC","134","Success: PCCC Class - Execute PCCC"
"202","1.520197","10.50.1.54","10.200.1.18","TCP","134","[TCP Retransmission] 44818  >  2430 [PSH, ACK] Seq=3841 Ack=2843 Win=2000 Len=80"
"203","1.539031","10.200.1.18","10.50.1.54","CIP PCCC","112","PCCC Class - Execute PCCC - Diagnostic status"
"204","1.539364","10.200.1.18","10.50.1.54","TCP","112","[TCP Retransmission] 2430  >  44818 [PSH, ACK] Seq=2843 Ack=3921 Win=64240 Len=58"
"205","1.549519","10.50.1.54","10.200.1.18","CIP PCCC","134","Success: PCCC Class - Execute PCCC"
"206","1.549790","10.50.1.54","10.200.1.18","TCP","134","[TCP Retransmission] 44818  >  2430 [PSH, ACK] Seq=3921 Ack=2901 Win=2000 Len=80"
"207","1.578181","10.200.1.18","10.50.1.54","CIP PCCC","112","PCCC Class - Execute PCCC - Diagnostic status"
"208","1.578524","10.200.1.18","10.50.1.54","TCP","112","[TCP Retransmission] 2430  >  44818 [PSH, ACK] Seq=2901 Ack=4001 Win=64160 Len=58"
"209","1.589898","10.50.1.54","10.200.1.18","CIP PCCC","134","Success: PCCC Class - Execute PCCC"
"210","1.590239","10.50.1.54","10.200.1.18","TCP","134","[TCP Retransmission] 44818  >  2430 [PSH, ACK] Seq=4001 Ack=2959 Win=2000 Len=80"
"211","1.608397","10.200.1.18","10.50.1.54","CIP PCCC","112","PCCC Class - Execute PCCC - Diagnostic status"
"212","1.608674","10.200.1.18","10.50.1.54","TCP","112","[TCP Retransmission] 2430  >  44818 [PSH, ACK] Seq=2959 Ack=4081 Win=64080 Len=58"
"213","1.619706","10.50.1.54","10.200.1.18","CIP PCCC","134","Success: PCCC Class - Execute PCCC"
"214","1.619964","10.50.1.54","10.200.1.18","TCP","134","[TCP Retransmission] 44818  >  2430 [PSH, ACK] Seq=4081 Ack=3017 Win=2000 Len=80"
"215","1.639646","10.200.1.18","10.50.1.54","CIP PCCC","112","PCCC Class - Execute PCCC - Diagnostic status"
"216","1.639946","10.200.1.18","10.50.1.54","TCP","112","[TCP Retransmission] 2430  >  44818 [PSH, ACK] Seq=3017 Ack=4161 Win=64000 Len=58"
"217","1.649789","10.50.1.54","10.200.1.18","CIP PCCC","134","Success: PCCC Class - Execute PCCC"
"218","1.650067","10.50.1.54","10.200.1.18","TCP","134","[TCP Retransmission] 44818  >  2430 [PSH, ACK] Seq=4161 Ack=3075 Win=2000 Len=80"
"219","1.669043","10.200.1.18","10.50.1.54","CIP PCCC","112","PCCC Class - Execute PCCC - Diagnostic status"
"220","1.669349","10.200.1.18","10.50.1.54","TCP","112","[TCP Retransmission] 2430  >  44818 [PSH, ACK] Seq=3075 Ack=4241 Win=63920 Len=58"
"221","1.679722","10.50.1.54","10.200.1.18","CIP PCCC","134","Success: PCCC Class - Execute PCCC"
"222","1.679963","10.50.1.54","10.200.1.18","TCP","134","[TCP Retransmission] 44818  >  2430 [PSH, ACK] Seq=4241 Ack=3133 Win=2000 Len=80"
"223","1.698241","10.200.1.18","10.50.1.54","CIP PCCC","112","PCCC Class - Execute PCCC - Diagnostic status"
"224","1.698428","10.200.1.18","10.50.1.54","TCP","112","[TCP Retransmission] 2430  >  44818 [PSH, ACK] Seq=3133 Ack=4321 Win=63840 Len=58"
"225","1.709535","10.50.1.54","10.200.1.18","CIP PCCC","134","Success: PCCC Class - Execute PCCC"
"226","1.712583","10.50.1.54","10.200.1.18","TCP","134","[TCP Retransmission] 44818  >  2430 [PSH, ACK] Seq=4321 Ack=3191 Win=2000 Len=80"
"227","1.731352","10.200.1.18","10.50.1.54","CIP PCCC","112","PCCC Class - Execute PCCC - Diagnostic status"
"228","1.731690","10.200.1.18","10.50.1.54","TCP","112","[TCP Retransmission] 2430  >  44818 [PSH, ACK] Seq=3191 Ack=4401 Win=63760 Len=58"
"229","1.740027","10.50.1.54","10.200.1.18","CIP PCCC","134","Success: PCCC Class - Execute PCCC"
"230","1.740297","10.50.1.54","10.200.1.18","TCP","134","[TCP Retransmission] 44818  >  2430 [PSH, ACK] Seq=4401 Ack=3249 Win=2000 Len=80"
"231","1.758752","10.200.1.18","10.50.1.54","CIP PCCC","112","PCCC Class - Execute PCCC - Diagnostic status"
"232","1.759061","10.200.1.18","10.50.1.54","TCP","112","[TCP Retransmission] 2430  >  44818 [PSH, ACK] Seq=3249 Ack=4481 Win=63680 Len=58"
"233","1.769894","10.50.1.54","10.200.1.18","CIP PCCC","134","Success: PCCC Class - Execute PCCC"
"234","1.770093","10.50.1.54","10.200.1.18","TCP","134","[TCP Retransmission] 44818  >  2430 [PSH, ACK] Seq=4481 Ack=3307 Win=2000 Len=80"
"235","1.788988","10.200.1.18","10.50.1.54","CIP PCCC","112","PCCC Class - Execute PCCC - Diagnostic status"
"236","1.789339","10.200.1.18","10.50.1.54","TCP","112","[TCP Retransmission] 2430  >  44818 [PSH, ACK] Seq=3307 Ack=4561 Win=63600 Len=58"
"237","1.799708","10.50.1.54","10.200.1.18","CIP PCCC","134","Success: PCCC Class - Execute PCCC"
"238","1.799993","10.50.1.54","10.200.1.18","TCP","134","[TCP Retransmission] 44818  >  2430 [PSH, ACK] Seq=4561 Ack=3365 Win=2000 Len=80"
"239","1.828054","10.200.1.18","10.50.1.54","CIP PCCC","112","PCCC Class - Execute PCCC - Diagnostic status"
"240","1.828360","10.200.1.18","10.50.1.54","TCP","112","[TCP Retransmission] 2430  >  44818 [PSH, ACK] Seq=3365 Ack=4641 Win=63520 Len=58"
"241","1.840036","10.50.1.54","10.200.1.18","CIP PCCC","134","Success: PCCC Class - Execute PCCC"
"242","1.841066","10.50.1.54","10.200.1.18","TCP","134","[TCP Retransmission] 44818  >  2430 [PSH, ACK] Seq=4641 Ack=3423 Win=2000 Len=80"
"243","1.859582","10.200.1.18","10.50.1.54","CIP PCCC","112","PCCC Class - Execute PCCC - Diagnostic status"
"244","1.859943","10.200.1.18","10.50.1.54","TCP","112","[TCP Retransmission] 2430  >  44818 [PSH, ACK] Seq=3423 Ack=4721 Win=63440 Len=58"
"245","1.869653","10.50.1.54","10.200.1.18","CIP PCCC","134","Success: PCCC Class - Execute PCCC"
"246","1.872199","10.50.1.54","10.200.1.18","TCP","134","[TCP Retransmission] 44818  >  2430 [PSH, ACK] Seq=4721 Ack=3481 Win=2000 Len=80"
"247","1.890606","10.200.1.18","10.50.1.54","CIP PCCC","112","PCCC Class - Execute PCCC - Diagnostic status"
"248","1.890929","10.200.1.18","10.50.1.54","TCP","112","[TCP Retransmission] 2430  >  44818 [PSH, ACK] Seq=3481 Ack=4801 Win=63360 Len=58"
"249","1.899554","10.50.1.54","10.200.1.18","CIP PCCC","134","Success: PCCC Class - Execute PCCC"
"250","1.899879","10.50.1.54","10.200.1.18","TCP","134","[TCP Retransmission] 44818  >  2430 [PSH, ACK] Seq=4801 Ack=3539 Win=2000 Len=80"
"251","1.918981","10.200.1.18","10.50.1.54","CIP PCCC","112","PCCC Class - Execute PCCC - Diagnostic status"
"252","1.919193","10.200.1.18","10.50.1.54","TCP","112","[TCP Retransmission] 2430  >  44818 [PSH, ACK] Seq=3539 Ack=4881 Win=63280 Len=58"
"253","1.930450","10.50.1.54","10.200.1.18","CIP PCCC","134","Success: PCCC Class - Execute PCCC"
"254","1.930710","10.50.1.54","10.200.1.18","TCP","134","[TCP Retransmission] 44818  >  2430 [PSH, ACK] Seq=4881 Ack=3597 Win=2000 Len=80"
"255","1.949177","10.200.1.18","10.50.1.54","CIP PCCC","112","PCCC Class - Execute PCCC - Diagnostic status"
"256","1.949524","10.200.1.18","10.50.1.54","TCP","112","[TCP Retransmission] 2430  >  44818 [PSH, ACK] Seq=3597 Ack=4961 Win=63200 Len=58"
"257","1.959730","10.50.1.54","10.200.1.18","CIP PCCC","134","Success: PCCC Class - Execute PCCC"
"258","1.959977","10.50.1.54","10.200.1.18","TCP","134","[TCP Retransmission] 44818  >  2430 [PSH, ACK] Seq=4961 Ack=3655 Win=2000 Len=80"
"259","1.978505","10.200.1.18","10.50.1.54","CIP PCCC","112","PCCC Class - Execute PCCC - Diagnostic status"
"260","1.978761","10.200.1.18","10.50.1.54","TCP","112","[TCP Retransmission] 2430  >  44818 [PSH, ACK] Seq=3655 Ack=5041 Win=63120 Len=58"
"261","1.989529","10.50.1.54","10.200.1.18","CIP PCCC","134","Success: PCCC Class - Execute PCCC"
"262","1.989781","10.50.1.54","10.200.1.18","TCP","134","[TCP Retransmission] 44818  >  2430 [PSH, ACK] Seq=5041 Ack=3713 Win=2000 Len=80"
"263","2.007745","10.200.1.18","10.50.1.54","CIP PCCC","112","PCCC Class - Execute PCCC - Diagnostic status"
"264","2.008053","10.200.1.18","10.50.1.54","TCP","112","[TCP Retransmission] 2430  >  44818 [PSH, ACK] Seq=3713 Ack=5121 Win=63040 Len=58"
"265","2.019807","10.50.1.54","10.200.1.18","CIP PCCC","134","Success: PCCC Class - Execute PCCC"
"266","2.020099","10.50.1.54","10.200.1.18","TCP","134","[TCP Retransmission] 44818  >  2430 [PSH, ACK] Seq=5121 Ack=3771 Win=2000 Len=80"
"267","2.039007","10.200.1.18","10.50.1.54","CIP PCCC","112","PCCC Class - Execute PCCC - Diagnostic status"
"268","2.039349","10.200.1.18","10.50.1.54","TCP","112","[TCP Retransmission] 2430  >  44818 [PSH, ACK] Seq=3771 Ack=5201 Win=62960 Len=58"
"269","2.049781","10.50.1.54","10.200.1.18","CIP PCCC","134","Success: PCCC Class - Execute PCCC"
"270","2.050077","10.50.1.54","10.200.1.18","TCP","134","[TCP Retransmission] 44818  >  2430 [PSH, ACK] Seq=5201 Ack=3829 Win=2000 Len=80"
"271","2.078139","10.200.1.18","10.50.1.54","CIP PCCC","112","PCCC Class - Execute PCCC - Diagnostic status"
"272","2.078429","10.200.1.18","10.50.1.54","TCP","112","[TCP Retransmission] 2430  >  44818 [PSH, ACK] Seq=3829 Ack=5281 Win=62880 Len=58"
"273","2.089829","10.50.1.54","10.200.1.18","CIP PCCC","134","Success: PCCC Class - Execute PCCC"
"274","2.094299","10.50.1.54","10.200.1.18","TCP","134","[TCP Retransmission] 44818  >  2430 [PSH, ACK] Seq=5281 Ack=3887 Win=2000 Len=80"
"275","2.103113","10.200.1.18","10.50.1.54","CIP PCCC","112","PCCC Class - Execute PCCC - Diagnostic status"
"276","2.103936","10.200.1.18","10.50.1.54","TCP","112","[TCP Retransmission] 2430  >  44818 [PSH, ACK] Seq=3887 Ack=5361 Win=62800 Len=58"
"277","2.109548","10.50.1.54","10.200.1.18","CIP PCCC","134","Success: PCCC Class - Execute PCCC"
"278","2.112401","10.50.1.54","10.200.1.18","TCP","134","[TCP Retransmission] 44818  >  2430 [PSH, ACK] Seq=5361 Ack=3945 Win=2000 Len=80"
"279","2.140704","10.200.1.18","10.50.1.54","CIP PCCC","112","PCCC Class - Execute PCCC - Diagnostic status"
"280","2.140949","10.200.1.18","10.50.1.54","TCP","112","[TCP Retransmission] 2430  >  44818 [PSH, ACK] Seq=3945 Ack=5441 Win=64240 Len=58"
"281","2.149924","10.50.1.54","10.200.1.18","CIP PCCC","134","Success: PCCC Class - Execute PCCC"
"282","2.156847","10.50.1.54","10.200.1.18","TCP","134","[TCP Retransmission] 44818  >  2430 [PSH, ACK] Seq=5441 Ack=4003 Win=2000 Len=80"
"283","2.165493","10.200.1.18","10.50.1.54","CIP PCCC","112","PCCC Class - Execute PCCC - Diagnostic status"
"284","2.165858","10.200.1.18","10.50.1.54","TCP","112","[TCP Retransmission] 2430  >  44818 [PSH, ACK] Seq=4003 Ack=5521 Win=64160 Len=58"
"285","2.169497","10.50.1.54","10.200.1.18","CIP PCCC","134","Success: PCCC Class - Execute PCCC"
"286","2.169738","10.50.1.54","10.200.1.18","TCP","134","[TCP Retransmission] 44818  >  2430 [PSH, ACK] Seq=5521 Ack=4061 Win=2000 Len=80"
"287","2.198150","10.200.1.18","10.50.1.54","CIP PCCC","112","PCCC Class - Execute PCCC - Diagnostic status"
"288","2.198510","10.200.1.18","10.50.1.54","TCP","112","[TCP Retransmission] 2430  >  44818 [PSH, ACK] Seq=4061 Ack=5601 Win=64080 Len=58"
"289","2.209871","10.50.1.54","10.200.1.18","CIP PCCC","134","Success: PCCC Class - Execute PCCC"
"290","2.210112","10.50.1.54","10.200.1.18","TCP","134","[TCP Retransmission] 44818  >  2430 [PSH, ACK] Seq=5601 Ack=4119 Win=2000 Len=80"
"291","2.229345","10.200.1.18","10.50.1.54","CIP PCCC","112","PCCC Class - Execute PCCC - Diagnostic status"
"292","2.229754","10.200.1.18","10.50.1.54","TCP","112","[TCP Retransmission] 2430  >  44818 [PSH, ACK] Seq=4119 Ack=5681 Win=64000 Len=58"
"293","2.240013","10.50.1.54","10.200.1.18","CIP PCCC","134","Success: PCCC Class - Execute PCCC"
"294","2.240390","10.50.1.54","10.200.1.18","TCP","134","[TCP Retransmission] 44818  >  2430 [PSH, ACK] Seq=5681 Ack=4177 Win=2000 Len=80"
"295","2.258757","10.200.1.18","10.50.1.54","CIP PCCC","112","PCCC Class - Execute PCCC - Diagnostic status"
"296","2.258969","10.200.1.18","10.50.1.54","TCP","112","[TCP Retransmission] 2430  >  44818 [PSH, ACK] Seq=4177 Ack=5761 Win=63920 Len=58"
"297","2.269763","10.50.1.54","10.200.1.18","CIP PCCC","134","Success: PCCC Class - Execute PCCC"
"298","2.274990","10.50.1.54","10.200.1.18","TCP","134","[TCP Retransmission] 44818  >  2430 [PSH, ACK] Seq=5761 Ack=4235 Win=2000 Len=80"
"299","2.293979","10.200.1.18","10.50.1.54","CIP PCCC","112","PCCC Class - Execute PCCC - Diagnostic status"
"300","2.294352","10.200.1.18","10.50.1.54","TCP","112","[TCP Retransmission] 2430  >  44818 [PSH, ACK] Seq=4235 Ack=5841 Win=63840 Len=58"
"301","2.299883","10.50.1.54","10.200.1.18","CIP PCCC","134","Success: PCCC Class - Execute PCCC"
"302","2.302652","10.50.1.54","10.200.1.18","TCP","134","[TCP Retransmission] 44818  >  2430 [PSH, ACK] Seq=5841 Ack=4293 Win=2000 Len=80"
"303","2.320078","10.200.1.18","10.50.1.54","CIP PCCC","112","PCCC Class - Execute PCCC - Diagnostic status"
"304","2.320410","10.200.1.18","10.50.1.54","TCP","112","[TCP Retransmission] 2430  >  44818 [PSH, ACK] Seq=4293 Ack=5921 Win=63760 Len=58"
"305","2.330137","10.50.1.54","10.200.1.18","CIP PCCC","134","Success: PCCC Class - Execute PCCC"
"306","2.336167","10.50.1.54","10.200.1.18","TCP","134","[TCP Retransmission] 44818  >  2430 [PSH, ACK] Seq=5921 Ack=4351 Win=2000 Len=80"
"307","2.354609","10.200.1.18","10.50.1.54","CIP PCCC","112","PCCC Class - Execute PCCC - Diagnostic status"
"308","2.354763","10.200.1.18","10.50.1.54","TCP","112","[TCP Retransmission] 2430  >  44818 [PSH, ACK] Seq=4351 Ack=6001 Win=63680 Len=58"
"309","2.359595","10.50.1.54","10.200.1.18","CIP PCCC","134","Success: PCCC Class - Execute PCCC"
"310","2.359965","10.50.1.54","10.200.1.18","TCP","134","[TCP Retransmission] 44818  >  2430 [PSH, ACK] Seq=6001 Ack=4409 Win=2000 Len=80"
"311","2.387689","10.200.1.18","10.50.1.54","CIP PCCC","112","PCCC Class - Execute PCCC - Diagnostic status"
"312","2.388058","10.200.1.18","10.50.1.54","TCP","112","[TCP Retransmission] 2430  >  44818 [PSH, ACK] Seq=4409 Ack=6081 Win=63600 Len=58"
"313","2.399587","10.50.1.54","10.200.1.18","CIP PCCC","134","Success: PCCC Class - Execute PCCC"
"314","2.399830","10.50.1.54","10.200.1.18","TCP","134","[TCP Retransmission] 44818  >  2430 [PSH, ACK] Seq=6081 Ack=4467 Win=2000 Len=80"
"315","2.418987","10.200.1.18","10.50.1.54","CIP PCCC","112","PCCC Class - Execute PCCC - Diagnostic status"
"316","2.419181","10.200.1.18","10.50.1.54","TCP","112","[TCP Retransmission] 2430  >  44818 [PSH, ACK] Seq=4467 Ack=6161 Win=63520 Len=58"
"317","2.430343","10.50.1.54","10.200.1.18","CIP PCCC","134","Success: PCCC Class - Execute PCCC"
"318","2.430635","10.50.1.54","10.200.1.18","TCP","134","[TCP Retransmission] 44818  >  2430 [PSH, ACK] Seq=6161 Ack=4525 Win=2000 Len=80"
"319","2.449095","10.200.1.18","10.50.1.54","CIP PCCC","112","PCCC Class - Execute PCCC - Diagnostic status"
"320","2.449459","10.200.1.18","10.50.1.54","TCP","112","[TCP Retransmission] 2430  >  44818 [PSH, ACK] Seq=4525 Ack=6241 Win=63440 Len=58"
"321","2.459859","10.50.1.54","10.200.1.18","CIP PCCC","134","Success: PCCC Class - Execute PCCC"
"322","2.460132","10.50.1.54","10.200.1.18","TCP","134","[TCP Retransmission] 44818  >  2430 [PSH, ACK] Seq=6241 Ack=4583 Win=2000 Len=80"
"323","2.478481","10.200.1.18","10.50.1.54","CIP PCCC","112","PCCC Class - Execute PCCC - Diagnostic status"
"324","2.478867","10.200.1.18","10.50.1.54","TCP","112","[TCP Retransmission] 2430  >  44818 [PSH, ACK] Seq=4583 Ack=6321 Win=63360 Len=58"
"325","2.489599","10.50.1.54","10.200.1.18","CIP PCCC","134","Success: PCCC Class - Execute PCCC"
"326","2.489899","10.50.1.54","10.200.1.18","TCP","134","[TCP Retransmission] 44818  >  2430 [PSH, ACK] Seq=6321 Ack=4641 Win=2000 Len=80"
"327","2.507736","10.200.1.18","10.50.1.54","CIP PCCC","112","PCCC Class - Execute PCCC - Diagnostic status"
"328","2.508064","10.200.1.18","10.50.1.54","TCP","112","[TCP Retransmission] 2430  >  44818 [PSH, ACK] Seq=4641 Ack=6401 Win=63280 Len=58"
"329","2.519613","10.50.1.54","10.200.1.18","CIP PCCC","134","Success: PCCC Class - Execute PCCC"
"330","2.519996","10.50.1.54","10.200.1.18","TCP","134","[TCP Retransmission] 44818  >  2430 [PSH, ACK] Seq=6401 Ack=4699 Win=2000 Len=80"
"331","2.538996","10.200.1.18","10.50.1.54","CIP PCCC","112","PCCC Class - Execute PCCC - Diagnostic status"
